{
  "schema_version": "0.4.0",
  "id": "aaaaaaaa-aaaa-4aaa-8aaa-aaaaaaaaaaaa",
  "project_id": "11111111-1111-4111-8111-111111111111",
  "created_at": "2026-08-18T02:20:00Z",
  "created_by": "主编",
  "scene_id": "33333333-3333-4333-8333-333333333333",
  "purpose": "Validate",
  "story_spec_id": "22222222-2222-4222-8222-222222222222",
  "scene_card_id": "44444444-4444-4444-8444-444444444444",
  "scene_plan_id": "55555555-5555-4555-8555-555555555555",
  "scene_draft_excerpt": "她把残玉按进缺口，门轴轻响",
  "candidate_change_ids": [
    "66666666-6666-4666-8666-666666666666"
  ],
  "knowledge_boundaries": [
    "林晚不知残玉能开门"
  ],
  "canon_excerpts": [
    {
      "statement": "残玉只能由林晚触活",
      "source_evidence": "主编已批准并提交：残玉只能由林晚触活",
      "effective_story_time": "第一日拾玉之前"
    }
  ]
}
