{
  "schema_version": "0.4.0",
  "id": "91a10002-0004-4000-8000-000000000002",
  "project_id": "11111111-1111-4111-8111-111111111111",
  "created_at": "2026-08-18T03:00:00Z",
  "created_by": "主编",
  "scene_id": "91a10002-0002-4000-8000-000000000002",
  "purpose": "Validate",
  "story_spec_id": "91a10002-0001-4000-8000-000000000002",
  "scene_card_id": "91a10002-0003-4000-8000-000000000002",
  "scene_draft_excerpt": "林晚推开京城驿馆的木门",
  "candidate_change_ids": [
    "91a10002-0006-4000-8000-000000000002"
  ],
  "knowledge_boundaries": [
    "林晚不知残玉能开门"
  ],
  "canon_excerpts": [
    {
      "statement": "林晚 located_at 青石镇河滩",
      "source_evidence": "主编已批准：林晚仍在青石镇河滩",
      "effective_story_time": "第一日黄昏"
    }
  ]
}
