{
  "schema_version": "0.4.0",
  "id": "91a10001-0004-4000-8000-000000000001",
  "project_id": "11111111-1111-4111-8111-111111111111",
  "created_at": "2026-08-18T03:00:00Z",
  "created_by": "主编",
  "scene_id": "91a10001-0002-4000-8000-000000000001",
  "purpose": "Validate",
  "story_spec_id": "91a10001-0001-4000-8000-000000000001",
  "scene_card_id": "91a10001-0003-4000-8000-000000000001",
  "scene_draft_excerpt": "她记得自己在前日黎明就已站在河滩",
  "candidate_change_ids": [
    "91a10001-0006-4000-8000-000000000001"
  ],
  "knowledge_boundaries": [
    "林晚不知残玉能开门"
  ],
  "canon_excerpts": [
    {
      "statement": "林晚 present_at_time 第一日黄昏",
      "source_evidence": "主编已批准：林晚第一日黄昏在河滩",
      "effective_story_time": "第一日黄昏"
    }
  ]
}
