{
  "schema_version": "0.4.0",
  "id": "91a10006-0004-4000-8000-000000000006",
  "project_id": "11111111-1111-4111-8111-111111111111",
  "created_at": "2026-08-18T03:00:00Z",
  "created_by": "主编",
  "scene_id": "91a10006-0002-4000-8000-000000000006",
  "purpose": "Validate",
  "story_spec_id": "91a10006-0001-4000-8000-000000000006",
  "scene_card_id": "91a10006-0003-4000-8000-000000000006",
  "scene_draft_excerpt": "林晚当夜凡人施展御空术掠过河面",
  "candidate_change_ids": [
    "91a10006-0006-4000-8000-000000000006"
  ],
  "knowledge_boundaries": [
    "林晚不知残玉能开门"
  ],
  "canon_excerpts": [
    {
      "statement": "凡人不可御空",
      "source_evidence": "规格写定：禁止凡人施展御空术",
      "effective_story_time": "开篇之前"
    }
  ]
}
