{
  "schema_version": "0.4.0",
  "id": "91a10003-0004-4000-8000-000000000003",
  "project_id": "11111111-1111-4111-8111-111111111111",
  "created_at": "2026-08-18T03:00:00Z",
  "created_by": "主编",
  "scene_id": "91a10003-0002-4000-8000-000000000003",
  "purpose": "Validate",
  "story_spec_id": "91a10003-0001-4000-8000-000000000003",
  "scene_card_id": "91a10003-0003-4000-8000-000000000003",
  "scene_draft_excerpt": "客商把残玉塞进自己袖里",
  "candidate_change_ids": [
    "91a10003-0006-4000-8000-000000000003"
  ],
  "knowledge_boundaries": [
    "林晚不知残玉能开门"
  ],
  "canon_excerpts": [
    {
      "statement": "残玉 held_by 林晚",
      "source_evidence": "主编已批准：残玉在林晚手里",
      "effective_story_time": "第一日黄昏"
    }
  ]
}
