{
  "schema_version": "0.4.0",
  "id": "91a10008-0004-4000-8000-000000000008",
  "project_id": "11111111-1111-4111-8111-111111111111",
  "created_at": "2026-08-18T03:00:00Z",
  "created_by": "主编",
  "scene_id": "91a10008-0002-4000-8000-000000000008",
  "purpose": "Validate",
  "story_spec_id": "91a10008-0001-4000-8000-000000000008",
  "scene_card_id": "91a10008-0003-4000-8000-000000000008",
  "scene_draft_excerpt": "林晚只顾把衣襟拉紧，河滩上什么也没留意，便转身回镇。",
  "candidate_change_ids": [],
  "knowledge_boundaries": [
    "林晚不知残玉能开门"
  ],
  "canon_excerpts": [
    {
      "statement": "本场须留下残玉微光伏笔",
      "source_evidence": "规格写定：伏笔河滩残玉须留微光",
      "effective_story_time": "第一日黄昏"
    }
  ]
}
