{
  "schema_version": "0.4.0",
  "id": "91a10009-0004-4000-8000-000000000009",
  "project_id": "11111111-1111-4111-8111-111111111111",
  "created_at": "2026-08-18T03:00:00Z",
  "created_by": "主编",
  "scene_id": "91a10009-0002-4000-8000-000000000009",
  "purpose": "Validate",
  "story_spec_id": "91a10009-0001-4000-8000-000000000009",
  "scene_card_id": "91a10009-0003-4000-8000-000000000009",
  "scene_draft_excerpt": "旁白提前写出残玉来历：它本是祠门钥匙",
  "candidate_change_ids": [
    "91a10009-0006-4000-8000-000000000009"
  ],
  "knowledge_boundaries": [
    "林晚不知残玉能开门"
  ],
  "canon_excerpts": [
    {
      "statement": "残玉来历尚未揭晓",
      "source_evidence": "规格写定：禁止写出残玉来历",
      "effective_story_time": "第一日黄昏"
    }
  ]
}
